#,ID,String,Message type,Supports special tags
UNION_INVITE,100,The union invitation has been accepted.,SYSTEM_NOTIFY,
UNION_INVITE,101,The union invitation was rejected.,SYSTEM_NOTIFY,
UNION_INVITE,102,The union invitation has been cancelled.,SYSTEM_NOTIFY,
UNION_INVITE,200,The union invitation has been cancelled.,SYSTEM_NOTIFY,
UNION_INVITE,-1702,The subject has already joined the union.,SYSTEM_WARNING,
UNION_INVITE,-1703,I am not a member of the union.,SYSTEM_WARNING,
UNION_INVITE,-1705,You have reached the maximum number of people you can belong to.,SYSTEM_WARNING,
UNION_INVITE,-1,The target does not meet the conditions of affiliation.,SYSTEM_WARNING,
UNION_INVITE,-1706,We are already soliciting.,SYSTEM_WARNING,
UNION_INVITE,-1707,It is the limit that can be solicited.,SYSTEM_WARNING,
UNION_INVITE,-1708,This is the limit that the target can solicit.,SYSTEM_WARNING,
UNION_INVITE,-1709,You do not have permission to invite.,SYSTEM_WARNING,
UNION_INVITE,-1710,I haven't invited you.,SYSTEM_WARNING,
UNION_INVITE,-1719,You cannot invite because it has not been 24 hours since you left.,SYSTEM_WARNING,
UNION_CREATE,0,I have created a union.,SYSTEM_NOTIFY,
UNION_CREATE,-1,Set the union name from 2 to 16 double-byte characters.,SYSTEM_WARNING,
UNION_CREATE,-2,The registration fee is insufficient.,SYSTEM_WARNING,
UNION_CREATE,-3,The soul rank is not enough.,SYSTEM_WARNING,
UNION_CREATE,-4,I have already joined the union.,SYSTEM_WARNING,
UNION_CREATE,-1711,The soul rank is not enough.,SYSTEM_WARNING,
UNION_CREATE,-1701,The union name contains characters that cannot be used.,SYSTEM_WARNING,
UNION_CREATE,-1702,I have already joined the union.,SYSTEM_WARNING,
UNION_CREATE,-1704,The union name is already in use.,SYSTEM_WARNING,
UNION_CREATE,-1705,There are not enough people to create a union.,SYSTEM_WARNING,
UNION_CREATE,-1719,It cannot be established until 24 hours have passed since the withdrawal.,SYSTEM_WARNING,
UNION_DROP,0,%s has left the union.,SYSTEM_NOTIFY,
UNION_LEAVE,0,I have withdrawn from%s.,SYSTEM_NOTIFY,
UNION_LEAVE,GENERIC,Failed to withdraw.,SYSTEM_WARNING,
UNION_LEAVE,-1703,I am not a member of the union.,SYSTEM_WARNING,
UNION_EXPEL,0,Excluded %s.,SYSTEM_NOTIFY,
UNION_EXPEL,GENERIC,Failed to remove%s.,SYSTEM_WARNING,
UNION_EXPEL,-1703,I am not a member of the union.,SYSTEM_WARNING,
UNION_EXPELLED,0,Excluded from%s.,SYSTEM_NOTIFY,
UNION_CHANGE_LEADER,0,%s is now a union leader.,SYSTEM_NOTIFY,
UNION_CHANGE_LEADER,-11,It is lost and cannot be changed to a union leader.,SYSTEM_WARNING,
UNION_CHANGE_LEADER,GENERIC,Failed to change the union leader.,SYSTEM_WARNING,
UNION_CHANGE_SUBLEADER,0,%s is now a union subleader.,SYSTEM_NOTIFY,
UNION_CHANGE_SUBLEADER,GENERIC,Failed to change Union Subleader.,SYSTEM_WARNING,
UNION_CHANGE_MEMBER,GENERIC,Failed to change members.,SYSTEM_WARNING,
UNION_CHANGE_MEMBER,0,%s is now a member.,SYSTEM_NOTIFY,
UNION_CHANGE_ROOKIE,GENERIC,Failed to change apprenticeship.,SYSTEM_WARNING,
UNION_CHANGE_ROOKIE,0,%s has become an apprentice.,SYSTEM_NOTIFY,
UNION_DISBAND,0,The union has been disbanded.,SYSTEM_WARNING,
UNION_DISBAND,GENERIC,Failed to dissolve the union.,SYSTEM_NOTIFY,
UNION_DISBAND,1,The union was dissolved due to a shortage of members.,SYSTEM_IMPORTANCE,
UNION_DISBAND,-1703,I am not a member of the union.,SYSTEM_IMPORTANCE,
UNION_MANAGE,GENERIC,Union operation failed.,SYSTEM_WARNING,
UNION_MANAGE,1,Changed permissions for %s.,SYSTEM_NOTIFY,
UNION_MANAGE,2,The permissions have changed.,SYSTEM_NOTIFY,
UNION_INFO,0,Union announcements have changed.,SYSTEM_NOTIFY,
UNION_INFO,GENERIC,Failed to change the notification.,SYSTEM_WARNING,
UNION_INFO,-1709,You do not have permission to change the notification.,SYSTEM_WARNING,
UNION_INFO,-1715,Forbidden words are used.,SYSTEM_WARNING,
UNION_MANTLE_CREATE,0,I set the design of the union cloak.,SYSTEM_WARNING,
UNION_MANTLE_CREATE,-1720,The union cloak design can only be set by a reader.,SYSTEM_WARNING,
UNION_MANTLE_CREATE,-1722,The union level is insufficient.,SYSTEM_WARNING,
UNION_MANTLE_CREATE,GENERIC,Union cloak design settings failed [%d],SYSTEM_WARNING,
UNION_MANTLE_GET,0,I got a union cloak.,SYSTEM_WARNING,
UNION_MANTLE_GET,-1721,The union cloak design has not been set yet.,SYSTEM_WARNING,
UNION_MANTLE_GET,GENERIC,Failed to get Union Cloak [%d],SYSTEM_WARNING,
UNION_MANTLE_GET,-207,There is no space in the inventory,SYSTEM_WARNING,
UNION_MANTLE_GET,-1722,The union level is insufficient.,SYSTEM_WARNING,
UNION_GROWTH,GENERIC,Union growth failed [%d],SYSTEM_WARNING,
UNION_GROWTH,0,Grow the union.,SYSTEM_WARNING,
UNION_GROWTH,-1723,The union level cannot be raised any further.,SYSTEM_WARNING,
UNION_RENAME,0,Changed the union name.,SYSTEM_NOTIFY,
UNION_RENAME,-1,Set the union name from 2 to 16 double-byte characters.,SYSTEM_WARNING,
UNION_RENAME,-1701,The union name contains characters that cannot be used.,SYSTEM_WARNING,
UNION_RENAME,-1704,The union name is already in use.,SYSTEM_WARNING,
UNION_COMMENT,0,I have set a comment.,SYSTEM_NOTIFY,
UNION_COMMENT,GENERIC,Failed to set the comment.,SYSTEM_WARNING,
UNION_COMMENT,-1800,Forbidden words are used.,SYSTEM_WARNING,
UNION_AMENITY,-1724,There are not enough benefit points.,SYSTEM_WARNING,
UNION_AMENITY,-1725,The level required for benefits is insufficient.,SYSTEM_WARNING,
UNION_AMENITY,-1726,The benefit days are incorrect.,SYSTEM_WARNING,
UNION_AMENITY,GENERIC,Failed to grant benefits.,SYSTEM_WARNING,
#Email related logs,,,,
MAIL,-2400,The recipient has reached the email reception limit,SYSTEM_WARNING,
MAIL,-2401,Parcels cannot be sent outside the city,SYSTEM_WARNING,
MAIL,-2402,Items cannot be sent in the soul state,SYSTEM_WARNING,
MAIL,-2403,Unread emails and emails that have not been sent cannot be discarded,SYSTEM_WARNING,
MAIL,-2404,Unread emails and emails that have not been sent cannot be discarded,SYSTEM_WARNING,
MAIL,-2405,Protected emails cannot be discarded,SYSTEM_WARNING,
MAIL,-2406,You can't pick it up outside the city,SYSTEM_WARNING,
MAIL,-1,You can't pick it up outside the city,SYSTEM_WARNING,
MAIL,-2,You cannot send blank emails,SYSTEM_WARNING,
MAIL,-20,It's a soul name that doesn't exist,SYSTEM_WARNING,
MAIL,-1606,Insufficient money,SYSTEM_WARNING,
MAIL,-3,No destination has been entered,SYSTEM_WARNING,
MAIL,-4,Can't send to myself,SYSTEM_WARNING,
MAIL,-5,Items on sale at stalls cannot be sent,SYSTEM_WARNING,
MAIL,-2410,Can't send to myself,SYSTEM_WARNING,
MAIL,-900,There is no space in the inventory,SYSTEM_WARNING,
MAIL,-207,There is no space in the inventory,SYSTEM_WARNING,
MAIL,-553,I have a lot of money,SYSTEM_WARNING,
MAIL,-2411,Cannot be received in soul state,SYSTEM_WARNING,
MAIL,-2412,You cannot send money in the soul state,SYSTEM_WARNING,
MAIL,1,I have unread emails.,SYSTEM_WARNING,
MAIL,2,There are no emails that can be discarded,SYSTEM_WARNING,
MAIL,3,There are %d emails that have not been received. Please organize your incoming emails,SYSTEM_WARNING,
MAIL,-2414,The subject contains prohibited words,SYSTEM_WARNING,
MAIL,-2415,The text contains prohibited words,SYSTEM_WARNING,
MAIL,-2417,"I received an email"","" but the number of emails I received has reached the upper limit. Please organize your incoming emails",SYSTEM_WARNING,
MAIL,-3002,You cannot create a new parcel during the event.,SYSTEM_WARNING,
MAIL,GENERIC,Failed to send email,SYSTEM_WARNING,
#Friend relationship log,,,,
FRIEND_REGIST,10,I applied for friend registration to %s.,SYSTEM_NOTIFY,
FRIEND_REGIST,20,I refused to register as a friend.,SYSTEM_NOTIFY,
FRIEND_REGIST,2,Friend registration has been cancelled.,SYSTEM_NOTIFY,
FRIEND_REGIST,1,Friend registration was not accepted.,SYSTEM_NOTIFY,
FRIEND_REGIST,0,%s has been registered as a friend.,SYSTEM_NOTIFY,
FRIEND_REGIST,200,%s friend registration has been accepted and registered.,SYSTEM_WARNING,
FRIEND_REGIST,201,%s refused to register as a friend.,SYSTEM_WARNING,
FRIEND_REGIST,202,Failed to register as a friend.,SYSTEM_WARNING,
FRIEND_REGIST,-2101,%s is already registered as a friend.,SYSTEM_WARNING,
FRIEND_REGIST,-2102,I am requesting another person to register as a friend. Please apply again after receiving the answer.,SYSTEM_WARNING,
FRIEND_REGIST,-2103,There is no space in the friends list.,SYSTEM_WARNING,
FRIEND_REGIST,-2104,There is no space in the friend list of the other party.,SYSTEM_WARNING,
FRIEND_REGIST,-2105,The other person is registering as a friend with another person. Please apply again after a while.,SYSTEM_WARNING,
FRIEND_REGIST,-2106,%s refused to register as a friend.,SYSTEM_WARNING,
FRIEND_REGIST,-2108,We are currently requesting%s to register as a friend.,SYSTEM_WARNING,
FRIEND_REGIST,GENERIC,Failed to register as a friend,SYSTEM_WARNING,
FRIEND_DELETE,-1,The friend could not be deleted.,SYSTEM_NOTIFY,
FRIEND_DELETE,0,%s has been removed from the friends list.,SYSTEM_IMPORTANCE,
FRIEND_DELETE,1,the %s soul has been deleted and has been removed from the friends list.,SYSTEM_IMPORTANCE,
FRIEND_ONLINESTATE,0,%s is online.,SYSTEM_NOTIFY,
#Deny list related logs,,,,
REFUSAL_LIST,0,%s has been added to the deny list.,SYSTEM_NOTIFY,
REFUSAL_LIST,1,Removed %s from the deny list.,SYSTEM_NOTIFY,
REFUSAL_LIST,2,the %s soul has been removed and has been removed from the deny list.,SYSTEM_IMPORTANCE,
REFUSAL_LIST,-1,The operation is invalid.,SYSTEM_WARNING,
REFUSAL_LIST,-20,It is a soul name that does not exist.,SYSTEM_WARNING,
REFUSAL_LIST,-2201,It is the target registered in the rejection list.,SYSTEM_WARNING,
REFUSAL_LIST,-2202,It is registered in the other party's rejection list.,SYSTEM_WARNING,
REFUSAL_LIST,-2203,It is a soul name that does not exist.,SYSTEM_WARNING,
REFUSAL_LIST,-2204,The deny list is full.,SYSTEM_WARNING,
REFUSAL_LIST,-2205,It is a soul name that has already been registered.,SYSTEM_WARNING,
REFUSAL_LIST,-2206,You cannot register yourself.,SYSTEM_WARNING,
REFUSAL_LIST,-2207,It is a soul name that does not exist.,SYSTEM_WARNING,
REFUSAL_LIST,-2208,Party members cannot be on the deny list,SYSTEM_WARNING,
REFUSAL_LIST,GENERIC,Failed to register the deny list,SYSTEM_WARNING,
# Street stall,,,,
STALL,1,Nothing is listed,SYSTEM_WARNING,
STALL,2,It is an item that has been exhibited,SYSTEM_WARNING,
STALL,3,Items that are equipped cannot be listed,SYSTEM_WARNING,
STALL,4,Unidentified items cannot be listed,SYSTEM_WARNING,
STALL,5,Sold %3%d pieces of %2%s to %1%s,SYSTEM_WARNING,
STALL,6,Opened a store,SYSTEM_WARNING,
STALL,7,The store has been closed,SYSTEM_WARNING,
STALL,8,You have reached the limit of the listing limit,SYSTEM_WARNING,
STALL,9,The item for sale was stolen,SYSTEM_WARNING,
STALL,10,Insufficient stock,SYSTEM_WARNING,
STALL,11,The item is sold out,SYSTEM_WARNING,
STALL,12,Insufficient money,SYSTEM_WARNING,
STALL,13,There is no space in the inventory,SYSTEM_WARNING,
STALL,14,The store name is not set,SYSTEM_WARNING,
STALL,15,Bags in use cannot be listed,SYSTEM_WARNING,
STALL,16,You cannot open a store in the soul state,SYSTEM_WARNING,
STALL,17,Failed to open a stall,SYSTEM_WARNING,
STALL,18,Items that cannot be listed at stalls,SYSTEM_WARNING,
STALL,19,Items listed at stalls cannot be equipped,SYSTEM_WARNING,
STALL,20,The purchase limit has been exceeded,SYSTEM_WARNING,
STALL,21,Items cannot be used during the stalls.,SYSTEM_WARNING,
STALL,22,No more listings are possible.,SYSTEM_WARNING,
STALL,23,I failed to purchase a stall.,SYSTEM_WARNING,
STALL,24,Items being sent by email cannot be listed,SYSTEM_WARNING,
STALL,25,Items in the Avatar Inventory cannot be listed.,SYSTEM_WARNING,
STALL,26,Items registered in the stall cannot be moved to the avatar inventory.,SYSTEM_WARNING,
STALL,27,Items in the temporary inventory cannot be listed.,SYSTEM_WARNING,
STALL,-1600,It exceeds the maximum value of the stall amount,SYSTEM_WARNING,
STALL,-1601,It is in a state where stall transactions are not possible,SYSTEM_WARNING,
STALL,-1602,There are no characters open,SYSTEM_WARNING,
STALL,-1603,It is an item that does not exist,SYSTEM_WARNING,
STALL,-1604,The number of items is invalid,SYSTEM_WARNING,
STALL,-1605,There is no space in the inventory,SYSTEM_WARNING,
STALL,-1606,Insufficient money,SYSTEM_WARNING,
STALL,-1607,It is not possible to open stalls at this location.,SYSTEM_WARNING,
STALL,-1608,There is a problem with this item,SYSTEM_WARNING,
STALL,-1609,There is not enough space to open a stall.,SYSTEM_WARNING,
STALL,-1701,The stall name is incorrect,SYSTEM_WARNING,
STALL,-215,It is not your property.,SYSTEM_WARNING,
STALL,-3002,You cannot buy or sell at stalls during the event.,SYSTEM_WARNING,
STALL,GENERIC,Street stall error,SYSTEM_WARNING,
#Gem,,,,
GEM,-1103,Equipment is not set,SYSTEM_WARNING,
GEM,-2300,Not in a gem state,SYSTEM_WARNING,
GEM,-2301,Socket is not free,SYSTEM_WARNING,
GEM,-2302,Different types of sockets and gems,SYSTEM_WARNING,
GEM,-2303,Not a gem,SYSTEM_WARNING,
GEM,-2304,Not a piece of gem,SYSTEM_WARNING,
GEM,-2305,Not enough gem shards,SYSTEM_WARNING,
GEM,-2306,Different types of gem shards,SYSTEM_WARNING,
GEM,-2307,Already set,SYSTEM_WARNING,
GEM,-2308,Jam shard slot is incorrect,SYSTEM_WARNING,
GEM,-2309,This item cannot be used for compositing,SYSTEM_WARNING,
GEM,-2310,Not enough synthetic gems,SYSTEM_WARNING,
GEM,-2311,Not from synthetic materials,SYSTEM_WARNING,
GEM,-2312,There is no synthetic material,SYSTEM_WARNING,
GEM,-2313,The synthesis source gem slot is invalid,SYSTEM_WARNING,
GEM,-2314,Synthesis failed,SYSTEM_WARNING,
GEM,-2315,No gems,SYSTEM_WARNING,
GEM,-2320,Extraction failed,SYSTEM_WARNING,
GEM,-2321,Items that cannot be used for extraction,SYSTEM_WARNING,
GEM,-2322,There are no extracted items,SYSTEM_WARNING,
GEM,-2323,Extracted items do not have decorative gems,SYSTEM_WARNING,
GEM,-2324,Not an extract material,SYSTEM_WARNING,
GEM,-2325,It is an item that does not fit the extraction,SYSTEM_WARNING,
GEM,-2326,The extraction source gem slot is invalid,SYSTEM_WARNING,
GEM,-700,I don't have enough money.,SYSTEM_WARNING,
GEM,-207,There is no space in the inventory.,SYSTEM_WARNING,
GEM,-201,Gem cannot be installed in the warehouse.,SYSTEM_WARNING,
GEM,200,The corresponding gem can only be used on the specified part.,SYSTEM_WARNING,
GEM,201,"When this composition is performed"","" there are no usable equipment parts.",SYSTEM_WARNING,
#title,,,,
HONOR,0,"Equipped with the title of """"""%s""""""",SYSTEM_NOTIFY,
HONOR,GENERIC,Failed to equip the title,SYSTEM_WARNING,
HONOR,2,You cannot change the equipment of the title while it is lost.,SYSTEM_WARNING,
#Lost resurrection,,,,
REVIVE LOST,GENERIC,Resurrection processing failed (ErrCode:%d),SYSTEM_WARNING,
REVIVE LOST,-1,General purpose resurrection failure error,SYSTEM_WARNING,
REVIVE LOST,-700,Not enough RG,SYSTEM_WARNING,
#Job change related,,,,
JOBCHANGE,GENERIC,Unknown job change error,SYSTEM_WARNING,
JOBCHANGE,-1,I failed to change jobs.,SYSTEM_WARNING,
JOBCHANGE,-2501,I don't have a job change certificate.,SYSTEM_WARNING,
JOBCHANGE,-2502,There are not enough parameters required to change jobs.,SYSTEM_WARNING,
JOBCHANGE,-2503,It does not meet the alignment required for changing jobs.,SYSTEM_WARNING,
JOBCHANGE,-2504,The parameters assigned to the job change are incorrect.,SYSTEM_WARNING,
JOBCHANGE,-2505,The total skill level to be inherited exceeds the total inheritable level.,SYSTEM_WARNING,
JOBCHANGE,-2506,I cannot change jobs because I am in the same occupation.,SYSTEM_WARNING,
JOBCHANGE,-2507,You cannot change jobs because you are equipped with a cursed item.,SYSTEM_WARNING,
JOBCHANGE,-2508,The soul rank required to change jobs is insufficient.,SYSTEM_WARNING,
JOBCHANGE,-2509,You cannot change jobs while trading.,SYSTEM_WARNING,
JOBCHANGE,-2510,You cannot change jobs during the stall.,SYSTEM_WARNING,
JOBCHANGE,-2511,The lottery time for bonus points for changing jobs is incorrect,SYSTEM_WARNING,
JOBCHANGE,-2512,Skills that cannot be inherited are set.,SYSTEM_WARNING,
JOBCHANGE,-2514,You cannot change jobs because you cannot change the equipment.,SYSTEM_WARNING,
JOBCHANGE,-2515,The same inheritance skill is set.,SYSTEM_WARNING,
JOBCHANGE,1,I cannot change jobs because I am in the same occupation.,SYSTEM_WARNING,
JOBCHANGE,2,I don't have enough money to change jobs.,SYSTEM_WARNING,
#Gacha related,,,,
RANDOMBOX,2704,I can't receive it now.,SYSTEM_WARNING,
RANDOMBOX,10000,Currently %s cannot be opened.,SYSTEM_WARNING,
RANDOMBOX,-2701,My inventory is full and I can't receive it.,SYSTEM_WARNING,
RANDOMBOX,-2702,I have an item that I haven't received yet.,SYSTEM_WARNING,
RANDOMBOX,-2703,I don't own %s.,SYSTEM_WARNING,
RANDOMBOX,-2704,You cannot receive it outside the city.,SYSTEM_WARNING,
RANDOMBOX,-2705,You cannot receive it in a ghost state.,SYSTEM_WARNING,
RANDOMBOX,-2706,The warehouse is full and I can't receive it.,SYSTEM_WARNING,
RANDOMBOX,-2707,This item cannot be stored in the warehouse.,SYSTEM_WARNING,
RANDOMBOX,-2708,You cannot open %s outside the city.,SYSTEM_WARNING,
RANDOMBOX_ALL,2704,I can't receive it now.,SYSTEM_WARNING,
RANDOMBOX_ALL,10000,Currently %s cannot be opened.,SYSTEM_WARNING,
RANDOMBOX_ALL,-2701,My inventory is full and I can't receive it.,SYSTEM_WARNING,
RANDOMBOX_ALL,-2702,I have an item that I haven't received yet.,SYSTEM_WARNING,
RANDOMBOX_ALL,-2703,I don't own %s.,SYSTEM_WARNING,
RANDOMBOX_ALL,-2704,You cannot receive it outside the city.,SYSTEM_WARNING,
RANDOMBOX_ALL,-2705,You cannot receive it in a ghost state.,SYSTEM_WARNING,
RANDOMBOX_ALL,-2706,The warehouse is full and I can't receive it.,SYSTEM_WARNING,
RANDOMBOX_ALL,-2707,I did not receive any items that could not be stored in the warehouse.,SYSTEM_WARNING,
RANDOMBOX_ALL,-2708,You cannot open %s outside the city.,SYSTEM_WARNING,
#Premium service related,,,,
PREMIUMSERVICE_ATTACH,1,The effect of <premium name> has been applied,SELF_BUFF_START,1
PREMIUMSERVICE_DETACH,1,The effect of <premium name> has ended,SELF_BUFF_END,1
#Comment related,,,,
COMMENT,GENERIC,Comment setting failed: <errcode>,SYSTEM_WARNING,1
COMMENT,1,Comments cannot be entered in more than 4 lines,SYSTEM_WARNING,
COMMENT,2,I haven't entered any characters in the comment,SYSTEM_WARNING,
#Command related,,,,
CMDEXEC,GENERIC,This is a command that does not exist,SYSTEM_WARNING,
#quest,,,,
QUEST,-203,No item selected,SYSTEM_WARNING,
QUEST,-207,There is no space in the inventory,SYSTEM_WARNING,
QUEST,-700,I don't have enough money,SYSTEM_WARNING,
QUEST,-701,I can't have any more money,SYSTEM_WARNING,
QUEST,-101,The quest ID is invalid,SYSTEM_WARNING,
QUEST,-102,Illegal quest storage slot,SYSTEM_WARNING,
QUEST,-103,The quest chapter number is incorrect,SYSTEM_WARNING,
QUEST,-104,Not enough quest storage slots,SYSTEM_WARNING,
QUEST,-105,The quest time limit has been exceeded,SYSTEM_WARNING,
QUEST,-106,The goal of the quest has not been achieved,SYSTEM_WARNING,
QUEST,-107,It is a type that can not abandon the quest,SYSTEM_WARNING,
QUEST,-108,Duplicate quests,SYSTEM_WARNING,
QUEST,-109,Outside the quest order level,SYSTEM_WARNING,
QUEST,-110,Out of quest order alignment,SYSTEM_WARNING,
QUEST,-111,The number of quest orders per day has been exceeded,SYSTEM_WARNING,
QUEST,-112,Insufficient valuables required to order quests,SYSTEM_WARNING,
QUEST,1,%s allows you to receive the mission bonus again!,SYSTEM_NOTIFY,
#Return command,,,,
RETURN_HOME,GENERIC,The return command cannot be executed.,SYSTEM_WARNING,
RETURN_HOME,-29,The return command cannot be executed while recovering the corpse.,SYSTEM_WARNING,
RETURN_HOME,-30,The return command cannot be executed because some people are fishing for corpses.,SYSTEM_WARNING,
#Blacklist related,,,,
BLACKLIST_LOCK,GENERIC,Blacklist lock failed,SYSTEM_WARNING,
BLACKLIST_CLEAR,0,Cleared the blacklist,SYSTEM_WARNING,
BLACKLIST_CLEAR,GENERIC,Failed to clear the blacklist,SYSTEM_WARNING,
#Skill acquisition related,,,,
SKILL_GAIN,0,Acquired %s of occupational characteristics,SYSTEM_NOTIFY,
SKILL_GAIN,1,Forgot %s of occupational characteristics,SYSTEM_NOTIFY,
#Prize neck related,,,,
WANTED,0,The maximum prize amount is %sG. </br> You cannot win more than the limit.,SYSTEM_NOTIFY,
WANTED,1,I paid bail.,SYSTEM_NOTIFY,
WANTED,-3506,No prize money can be placed on the bounty neck in prison.,SYSTEM_WARNING,
WANTED,-3507,No prize money can be awarded to subjects who have not been released on bail for a certain period of time.,SYSTEM_WARNING,
WANTED,5,Characters in prison cannot be deleted.,SYSTEM_NOTIFY,
WANTED,6,I hung a prize of %2%sG on %1%s.,SYSTEM_NOTIFY,
WANTED,7,I got %s bounty points!,SYSTEM_NOTIFY,
WANTED,8,It was released from the bounty neck!,SYSTEM_NOTIFY,
WANTED,9,Registered as a bounty neck.,SYSTEM_NOTIFY,
WANTED,10,It seems that I bought a grudge from many people!,SYSTEM_NOTIFY,
WANTED,11,Evil deeds roared in the world!,SYSTEM_NOTIFY,
WANTED,12,%s has been removed from the bounty list.,SYSTEM_NOTIFY,
WANTED,13,"Since some characters are in prison"","" new ones cannot be created.",SYSTEM_NOTIFY,
WANTED,14,Currently registered as a bounty neck.,SYSTEM_NOTIFY,
WANTED,-20,It is a soul that does not exist.,SYSTEM_WARNING,
WANTED,-702,You cannot win prizes in the soul state.,SYSTEM_WARNING,
WANTED,-3500,The status of the bounty neck is incorrect.,SYSTEM_WARNING,
WANTED,-3501,Not on the blacklist.,SYSTEM_WARNING,
WANTED,-3502,Only characters in prison can enter.,SYSTEM_WARNING,
WANTED,-3503,"Seoul"","" who is not a criminal"","" cannot be the bounty.",SYSTEM_WARNING,
WANTED,-3508,You cannot register for the bounty because it has already been subdued.,SYSTEM_WARNING,
WANTED,GENERIC,Prize neck error.,SYSTEM_WARNING,
#Soul password related,,,,
SOULPASSWORD,GENERIC,Unknown error occurred,SYSTEM_NOTIFY,
SOULPASSWORD,-36,The password is invalid.,SYSTEM_NOTIFY,
SOULPASSWORD,-37,The password has already been set.,SYSTEM_NOTIFY,
SOULPASSWORD,-38,"Failed to authenticate the soul password. </br> End the game. </br> </br> <color ITEM> If you have forgotten your soul password"","" please contact us from ""Support""-> ""Inquiries"" on the official website.",SYSTEM_NOTIFY,1
SOULPASSWORD_CL,0,Please enter the soul password you set earlier for confirmation.,SYSTEM_NOTIFY,1
SOULPASSWORD_CL,1,Please set the soul password as a 4-10 digit number.,SYSTEM_NOTIFY,1
SOULPASSWORD_CL,2,The soul password is <br> incorrect.,SYSTEM_NOTIFY,1
SOULPASSWORD_CL,3,"Set the soul password. </br> </br> <color IMPORTANT> Caution </strong> -You cannot change your soul password. Please be careful not to forget it. </br> ・ Avoid numbers that are easy to guess"","" such as date of birth. </br> -Please set a different soul password for each soul to improve security. </br> </br> </color> Are you sure?",SYSTEM_NOTIFY,1
SOULPASSWORD_CL,4,I have set a soul password.,SYSTEM_NOTIFY,1
SOULPASSWORD_CL,5,"I cannot confirm the soul password"","" so I will return to the login screen.",SYSTEM_NOTIFY,1
SOULPASSWORD_CL,6,Set a soul password to enhance security. </br> </br> <color IMPORTANT> ・ Soul password must be set for each soul created in each world. </br> -You cannot play the game without setting a soul password. </br> -The set soul password cannot be changed. Please be careful not to forget it. </color>,SYSTEM_NOTIFY,1
#Error transmission related,,,,
ERROR_REPORT,1,%d error log transmission completed,SYSTEM_IMPORTANCE,
ERROR_REPORT,GENERIC,Unknown error Report sending error:%d,SYSTEM_IMPORTANCE,
ERROR_REPORT,-4100,The transmission of the registered error log has been confirmed. This error log has already been registered and will be skipped.,SYSTEM_WARNING,
#auction,,,,
AUCTION,1,This item cannot be listed.,SYSTEM_WARNING,
AUCTION,2,Items that are equipped cannot be listed.,SYSTEM_WARNING,
AUCTION,3,The exhibition space is not available.,SYSTEM_WARNING,
AUCTION,4,The lowest price is higher than the prompt decision price.,SYSTEM_WARNING,
AUCTION,5,Please enter an amount higher than the amount you have already bid.,SYSTEM_WARNING,
AUCTION,6,The bid space is not available.,SYSTEM_WARNING,
AUCTION,7,The bid amount cannot be changed because the effect of the Diment Medal has expired.,SYSTEM_WARNING,
AUCTION,8,The item cannot be listed because the effect of the Diment Medal has expired.,SYSTEM_WARNING,
AUCTION,9,The numerical value of the search condition is invalid. \nPlease set from the minimum value to the maximum value.,SYSTEM_WARNING,
AUCTION,-3700,I have already exhibited.,SYSTEM_WARNING,
AUCTION,-3701,It is in an illegal state.,SYSTEM_WARNING,
AUCTION,-3702,I have already bid.,SYSTEM_WARNING,
AUCTION,-3703,The remaining time is less than 1 hour and cannot be canceled.,SYSTEM_WARNING,
AUCTION,-3704,It cannot be canceled because there are bidders.,SYSTEM_WARNING,
AUCTION,-3705,The listing period has expired.,SYSTEM_WARNING,
AUCTION,-3706,The listing has been cancelled.,SYSTEM_WARNING,
AUCTION,-3707,It has already been sold.,SYSTEM_WARNING,
AUCTION,-3709,I can't register any more tabs! \nPlease delete the registration tab.,SYSTEM_WARNING,
AUCTION,-203,There are no slots available.,SYSTEM_WARNING,
AUCTION,-204,The item quantity is incorrect.,SYSTEM_WARNING,
AUCTION,-212,This item cannot be listed.,SYSTEM_WARNING,
AUCTION,GENERIC,Auction error.,SYSTEM_WARNING,
#macro,,,,
MACRO_EDIT,1,Registered %2%s macro at %1%d,SYSTEM_NOTIFY,
MACRO_EDIT,2,Deleted %2%s macro of %1%d,SYSTEM_NOTIFY,
MACRO_EDIT,3,Macro execution failed,SYSTEM_WARNING,
MACRO_EDIT,4,Stops macro execution,SYSTEM_NOTIFY,
MACRO_EDIT,5,Cannot be used due to cool time,SYSTEM_NOTIFY,
MACRO_EDIT,6,You cannot shout from the macro,SYSTEM_WARNING,
MACRO_EDIT,7,Stopped macro execution,SYSTEM_NOTIFY,
MACRO_EDIT,8,There is no space on this page,SYSTEM_NOTIFY,
#Custom slot,,,,
CUSTOMSLOT_SET,GENERIC,Failed to set the custom slot. [%d],SYSTEM_NOTIFY,
CUSTOMSLOT_SET,-3802,The maximum number of custom slots set has been exceeded.,SYSTEM_NOTIFY,
CUSTOMSLOT_SET,0,I have set up a custom slot,SYSTEM_NOTIFY,
#profile,,,,
PROFILE,GENERIC,I can't view my profile (equipment),SYSTEM_WARNING,
PROFILE,1,I feel the line of sight from the criminal (%1%s %2%s),SYSTEM_NOTIFY,
PROFILE,2,You cannot see the profile (equipment) of a dead adventurer,SYSTEM_WARNING,
